chinese_name,english_name,country
潍坊科技学院,nan,China
山东英才学院,nan,China
青岛恒星科技学院,nan,China
青岛黄海学院,nan,China
山东现代学院,nan,China
山东协和学院,Shandong Xiehe University,China
山东工程职业技术大学,nan,China
烟台理工学院,nan,China
聊城大学东昌学院,nan,China
青岛城市学院,nan,China
潍坊理工学院,nan,China
山东财经大学燕山学院,nan,China
山东石油化工学院,nan,China
山东外国语职业技术大学,nan,China
泰山科技学院,nan,China
山东华宇工学院,Shandong Huayu University of Technology,China
山东外事职业大学,nan,China
青岛工学院,Qingdao University of Technology,China
青岛农业大学海都学院,nan,China
齐鲁理工学院,nan,China
山东财经大学东方学院,nan,China
烟台科技学院,nan,China
山东政法学院,Shandong University of Political Science and Law,China
齐鲁师范学院,Qilu Normal University,China
山东青年政治学院,Shandong Youth University of Political Science,China
青岛电影学院,nan,China
山东管理学院,Shandong Management University,China
山东农业工程学院,Shandong Agriculture and Engineering University,China
康复大学,nan,China
淄博职业技术大学,nan,China
山东医学高等专科学校,nan,China
菏泽医学专科学校,nan,China
山东商业职业技术学院,nan,China
山东电力高等专科学校,nan,China
日照职业技术学院,nan,China
曲阜远东职业技术学院,nan,China
青岛职业技术学院,nan,China
威海职业学院,nan,China
山东职业学院,nan,China
山东劳动职业技术学院,nan,China
莱芜职业技术学院,nan,China
济宁职业技术学院,nan,China
潍坊职业学院,nan,China
烟台职业学院,nan,China
东营职业学院,nan,China
聊城职业技术学院,nan,China
滨州职业学院,nan,China
山东科技职业学院,nan,China
山东服装职业学院,nan,China
德州科技职业学院,nan,China
山东力明科技职业学院,nan,China
山东圣翰财贸职业学院,nan,China
山东水利职业学院,nan,China
山东畜牧兽医职业学院,nan,China
青岛飞洋职业技术学院,nan,China
东营科技职业学院,nan,China
山东交通职业学院,nan,China
山东外贸职业学院,nan,China
青岛酒店管理职业技术学院,nan,China
山东信息职业技术学院,nan,China
青岛港湾职业技术学院,nan,China
山东胜利职业学院,nan,China
山东经贸职业学院,nan,China
山东工业职业学院,nan,China
山东化工职业学院,nan,China
青岛求实职业技术学院,nan,China
济南职业学院,nan,China
烟台工程职业技术学院,nan,China
潍坊工商职业学院,nan,China
德州职业技术学院,nan,China
枣庄科技职业学院,nan,China
淄博师范高等专科学校,nan,China
山东中医药高等专科学校,nan,China
济南工程职业技术学院,nan,China
山东电子职业技术学院,nan,China
山东旅游职业学院,nan,China
山东铝业职业学院,nan,China
山东杏林科技职业学院,nan,China
泰山职业技术学院,nan,China
山东药品食品职业学院,nan,China
山东商务职业学院,nan,China
山东轻工职业学院,nan,China
山东城市建设职业学院,nan,China
烟台汽车工程职业学院,nan,China
山东司法警官职业学院,nan,China
菏泽家政职业学院,nan,China
山东传媒职业学院,nan,China
临沂职业学院,nan,China
枣庄职业学院,nan,China
山东理工职业学院,nan,China
山东文化产业职业学院,nan,China
青岛远洋船员职业学院,nan,China
济南幼儿师范高等专科学校,nan,China
济南护理职业学院,nan,China
泰山护理职业学院,nan,China
山东海事职业学院,nan,China
潍坊护理职业学院,nan,China
潍坊工程职业学院,nan,China
菏泽职业学院,nan,China
山东艺术设计职业学院,nan,China
威海海洋职业学院,nan,China
山东特殊教育职业学院,nan,China
烟台黄金职业学院,nan,China
日照航海工程职业学院,nan,China
青岛工程职业学院,nan,China
青岛幼儿师范高等专科学校,nan,China
烟台幼儿师范高等专科学校,nan,China
烟台文化旅游职业学院,nan,China
临沂科技职业学院,nan,China
青岛航空科技职业学院,nan,China
潍坊环境工程职业学院,nan,China
滨州科技职业学院,nan,China
山东城市服务职业学院,nan,China
潍坊食品科技职业学院,nan,China
烟台城市科技职业学院,nan,China
德州工程职业学院,nan,China
日照康养职业学院,nan,China
烟台卫生健康职业学院,nan,China
山东文化艺术职业学院,nan,China
聊城科技职业学院,nan,China
济宁汽车工程职业学院,nan,China
日照科技职业学院,nan,China
枣庄应用技术职业学院,nan,China
临沂城市职业学院,nan,China
菏泽生物医药职业学院,nan,China
华北水利水电大学,nan,China
郑州大学,nan,China
河南理工大学,nan,China
郑州轻工业大学,nan,China
河南工业大学,nan,China
河南科技大学,nan,China
中原工学院,nan,China
河南农业大学,nan,China
河南科技学院,nan,China
河南牧业经济学院,nan,China
河南中医药大学,nan,China
河南医药大学,nan,China
河南大学,nan,China
河南师范大学,nan,China
信阳师范大学,nan,China
周口师范学院,nan,China
安阳师范学院,nan,China
许昌学院,nan,China
南阳师范学院,nan,China
洛阳师范学院,nan,China
商丘师范学院,nan,China
河南财经政法大学,nan,China
郑州航空工业管理学院,nan,China
黄淮学院,nan,China
平顶山学院,nan,China
郑州工程技术学院,nan,China
洛阳理工学院,nan,China
新乡学院,nan,China
信阳农林学院,nan,China
河南工学院,nan,China
安阳工学院,nan,China
河南工程学院,nan,China
河南财政金融学院,nan,China
南阳理工学院,nan,China
河南城建学院,nan,China
河南警察学院,nan,China
黄河科技学院,nan,China
郑州警察学院,nan,China
郑州科技学院,nan,China
郑州工业应用技术学院,nan,China
郑州师范学院,nan,China
郑州财经学院,nan,China
黄河交通学院,nan,China
商丘工学院,nan,China
河南开封科技传媒学院,nan,China
中原科技学院,nan,China
信阳学院,nan,China
安阳学院,nan,China
豫北医学院,nan,China
新乡工程学院,nan,China
郑州工商学院,nan,China
郑州经贸学院,nan,China
商丘学院,nan,China
郑州商学院,nan,China
河南科技职业大学,nan,China
郑州升达经贸管理学院,nan,China
郑州西亚斯学院,nan,China
郑州美术学院,nan,China
漯河食品工程职业大学,nan,China
河南体育学院,nan,China
郑州健康学院,nan,China
黄河水利职业技术大学,nan,China
河南职业技术学院,nan,China
漯河职业技术学院,nan,China
三门峡职业技术学院,nan,China
郑州铁路职业技术学院,nan,China
开封大学,nan,China
焦作大学,nan,China
濮阳职业技术学院,nan,China
郑州电力高等专科学校,nan,China
许昌职业技术学院,nan,China
河南工业和信息化职业学院,nan,China
河南水利与环境职业学院,nan,China
商丘职业技术学院,nan,China
平顶山工业职业技术学院,nan,China
周口职业技术学院,nan,China
济源职业技术学院,nan,China
河南司法警官职业学院,nan,China
鹤壁职业技术学院,nan,China
河南工业职业技术学院,nan,China
焦作师范高等专科学校,nan,China
河南检察职业学院,nan,China
河南质量工程职业学院,nan,China
郑州信息科技职业学院,nan,China
漯河医学高等专科学校,nan,China
南阳医学高等专科学校,nan,China
商丘医学高等专科学校,nan,China
郑州电子信息职业技术学院,nan,China
信阳职业技术学院,nan,China
嵩山少林武术职业学院,nan,China
郑州工业安全职业学院,nan,China
永城职业学院,nan,China
河南经贸职业学院,nan,China
河南交通职业技术学院,nan,China
河南农业职业学院,nan,China
郑州旅游职业学院,nan,China
郑州职业技术学院,nan,China
河南信息统计职业学院,nan,China
河南林业职业学院,nan,China
河南工业贸易职业学院,nan,China
郑州电力职业技术学院,nan,China
河南建筑职业技术学院,nan,China
郑州城市职业学院,nan,China
安阳职业技术学院,nan,China
新乡职业技术学院,nan,China
驻马店职业技术学院,nan,China
焦作工贸职业学院,nan,China
许昌陶瓷职业学院,nan,China
郑州理工职业学院,nan,China
郑州信息工程职业学院,nan,China
长垣烹饪职业技术学院,nan,China
开封文化艺术职业学院,nan,China
河南应用技术职业学院,nan,China
河南艺术职业学院,nan,China
河南机电职业学院,nan,China
河南护理职业学院,nan,China
许昌电气职业学院,nan,China
信阳涉外职业技术学院,nan,China
鹤壁汽车工程职业学院,nan,China
南阳职业学院,nan,China
郑州商贸旅游职业学院,nan,China
河南推拿职业学院,nan,China
洛阳职业技术学院,nan,China
郑州幼儿师范高等专科学校,nan,China
安阳幼儿师范高等专科学校,nan,China
郑州黄河护理职业学院,nan,China
河南医学高等专科学校,nan,China
郑州财税金融职业学院,nan,China
南阳农业职业学院,nan,China
洛阳科技职业学院,nan,China
鹤壁能源化工职业学院,nan,China
平顶山文化艺术职业学院,nan,China
濮阳医学高等专科学校,nan,China
驻马店幼儿师范高等专科学校,nan,China
三门峡社会管理职业学院,nan,China
河南轻工职业学院,nan,China
河南测绘职业学院,nan,China
信阳航空职业学院,nan,China
郑州卫生健康职业学院,nan,China
河南物流职业学院,nan,China
河南地矿职业学院,nan,China
郑州亚欧交通职业学院,nan,China
河南女子职业学院,nan,China
河南对外经济贸易职业学院,nan,China
濮阳石油化工职业技术学院,nan,China
南阳科技职业学院,nan,China
兰考三农职业学院,nan,China
汝州职业技术学院,nan,China
林州建筑职业技术学院,nan,China
郑州电子商务职业学院,nan,China
郑州轨道工程职业学院,nan,China
郑州体育职业学院,nan,China
洛阳文化旅游职业学院,nan,China
周口文理职业学院,nan,China
信阳艺术职业学院,nan,China
郑州城建职业学院,nan,China
郑州医药健康职业学院,nan,China
平顶山职业技术学院,nan,China
南阳工艺美术职业学院,nan,China
濮阳科技职业学院,nan,China
商丘幼儿师范高等专科学校,nan,China
周口理工职业学院,nan,China
焦作新材料职业学院,nan,China
开封职业学院,nan,China
洛阳商业职业学院,nan,China
郑州软件职业技术学院,nan,China
郑州智能科技职业学院,nan,China
郑州食品工程职业学院,nan,China
郑州汽车工程职业学院,nan,China
驻马店农业工程职业学院,nan,China
信阳科技职业学院,nan,China
信阳工程职业学院,nan,China
周口城市职业学院,nan,China
河南新乡工商职业学院,nan,China
开封工程职业学院,nan,China
开封智慧健康职业学院,nan,China
周口智慧能源职业学院,nan,China
平顶山科技职业学院,nan,China
武汉大学,nan,China
华中科技大学,nan,China
武汉科技大学,nan,China
长江大学,nan,China
武汉工程大学,nan,China
中国地质大学（武汉）,nan,China
武汉纺织大学,nan,China
武汉轻工大学,nan,China
武汉理工大学,nan,China
湖北工业大学,nan,China
华中农业大学,nan,China
湖北中医药大学,nan,China
华中师范大学,nan,China
湖北大学,nan,China
湖北师范大学,Hubei Normal University,China
黄冈师范学院,nan,China
湖北民族大学,nan,China
汉江师范学院,Hanjiang Normal University,China
湖北文理学院,nan,China
中南财经政法大学,nan,China
武汉体育学院,nan,China
湖北美术学院,nan,China
中南民族大学,nan,China
湖北汽车工业学院,Hubei University of Automotive Technology,China
湖北工程学院,Hubei Engineering University,China
湖北理工学院,Hubei Institute of Technology,China
湖北科技学院,Hubei University of Science and Technology,China
湖北医药学院,nan,China
江汉大学,nan,China
三峡大学,nan,China
湖北警官学院,Hubei University of Police [zh],China
荆楚理工学院,Jingchu University of Technology,China
武汉音乐学院,nan,China
湖北经济学院,Hubei University of Economics [zh],China
武汉商学院,nan,China
武汉东湖学院,nan,China
汉口学院,nan,China
武昌首义学院,nan,China
武昌理工学院,nan,China
武汉生物工程学院,nan,China
武汉晴川学院,nan,China
湖北大学知行学院,nan,China
武汉城市学院,nan,China
三峡大学科技学院,nan,China
武汉文理学院,nan,China
湖北工业大学工程技术学院,nan,China
武汉工程大学邮电与信息工程学院,nan,China
武汉纺织大学外经贸学院,nan,China
武昌工学院,nan,China
武汉工商学院,nan,China
荆州学院,nan,China
长江大学文理学院,nan,China
湖北商贸学院,nan,China
湖北汽车工业学院科技学院,nan,China
湖北医药学院药护学院,nan,China
湖北恩施学院,nan,China
湖北经济学院法商学院,nan,China
武汉体育学院体育科技学院,nan,China
湖北师范大学文理学院,nan,China
湖北文理学院理工学院,nan,China
湖北工程学院新技术学院,nan,China
文华学院,nan,China
武汉学院,nan,China
武汉工程科技学院,nan,China
武汉华夏理工学院,nan,China
武汉传媒学院,nan,China
武汉设计工程学院,nan,China
湖北第二师范学院,Hubei University of Education [zh],China
武汉职业技术大学,nan,China
湖北三峡航空学院,nan,China
黄冈职业技术学院,nan,China
长江职业学院,nan,China
荆州理工职业学院,nan,China
湖北工业职业技术学院,Hubei Industrial Polytechnic,China
鄂州职业大学,nan,China
武汉城市职业学院,nan,China
湖北职业技术学院,nan,China
武汉船舶职业技术学院,nan,China
恩施职业技术学院,nan,China
襄阳职业技术学院,nan,China
武汉工贸职业学院,nan,China
荆州职业技术学院,nan,China
武汉工程职业技术学院,nan,China
仙桃职业学院,nan,China
湖北轻工职业技术学院,nan,China
湖北交通职业技术学院,nan,China
湖北中医药高等专科学校,nan,China
武汉航海职业技术学院,nan,China
武汉铁路职业技术学院,nan,China
武汉软件工程职业学院,nan,China
湖北三峡职业技术学院,nan,China
随州职业技术学院,nan,China
武汉电力职业技术学院,nan,China
湖北水利水电职业技术学院,nan,China
湖北城市建设职业技术学院,nan,China
武汉警官职业学院,nan,China
湖北生物科技职业学院,nan,China
湖北开放职业学院,nan,China
武汉科技职业学院,nan,China
武汉外语外事职业学院,nan,China
武汉信息传播职业技术学院,nan,China
武昌职业学院,nan,China
武汉商贸职业学院,nan,China
湖北艺术职业学院,nan,China
武汉交通职业学院,Wuhan Technical College of Communications [zh],China
咸宁职业技术学院,nan,China
长江工程职业技术学院,nan,China
江汉艺术职业学院,nan,China
武汉民政职业学院,nan,China
湖北黄冈应急管理职业技术学院,nan,China
湖北财税职业学院,nan,China
黄冈科技职业学院,nan,China
湖北国土资源职业学院,nan,China
湖北生态工程职业技术学院,nan,China
三峡电力职业学院,nan,China
湖北科技职业学院,nan,China
湖北青年职业学院,nan,China
湖北工程职业学院,nan,China
三峡旅游职业技术学院,nan,China
天门职业学院,nan,China
湖北体育职业学院,nan,China
襄阳汽车职业技术学院,nan,China
湖北幼儿师范高等专科学校,nan,China
湖北铁道运输职业学院,nan,China
武汉海事职业学院,nan,China
长江艺术工程职业学院,nan,China
荆门职业学院,nan,China
武汉铁路桥梁职业学院,nan,China
武汉光谷职业学院,nan,China
湖北健康职业学院,nan,China
湖北孝感美珈职业学院,nan,China
襄阳科技职业学院,nan,China
宜昌科技职业学院,nan,China
荆门通用航空职业技术学院,nan,China
湘潭大学,Xiangtan University,China
吉首大学,Jishou University,China
湖南大学,Hunan University,China
中南大学,Central South University,China
湖南科技大学,Hunan University of Science and Technology,China
长沙理工大学,Changsha University of Science and Technology,China
湖南农业大学,Hunan Agricultural University,China
中南林业科技大学,Central South University of Forestry and Technology,China
湖南中医药大学,Hunan University of Traditional Chinese Medicine,China
湖南师范大学,Hunan Normal University,China
湖南理工学院,Hunan Institute of Science and Technology,China
湘南学院,Xiangnan University,China
衡阳师范学院,Hengyang Normal University,China
邵阳学院,Shaoyang University,China
怀化学院,Huaihua University,China
湖南文理学院,Hunan University of Arts and Science,China
湖南科技学院,Hunan University of Science and Engineering,China
湖南人文科技学院,Hunan University of Humanities  Science and Technology,China
湖南工商大学,nan,China
南华大学,University of South China,China
长沙医学院,Changsha Medical College,China
长沙学院,Changsha University,China
湖南工程学院,Hunan Institute of Engineering,China
湖南城市学院,Hunan City University,China
湖南工学院,Hunan Institute of Technology,China
湖南财政经济学院,Hunan University of Finance and Economics,China
湖南警察学院,Hunan Police Academy,China
湖南工业大学,Hunan University of Technology,China
湖南女子学院,Hunan Women's University,China
湖南第一师范学院,Hunan First Normal University,China
湖南医药学院,Hunan University of Medicine,China
湖南涉外经济学院,Hunan International Economics University,China
湘潭大学兴湘学院,Xingxiang College  Xiangtan University,China
湖南工业大学科技学院,nan,China
湖南科技大学潇湘学院,nan,China
南华大学船山学院,nan,China
湘潭理工学院,nan,China
长沙工业学院,nan,China
湖南农业大学东方科技学院,nan,China
中南林业科技大学涉外学院,nan,China
常德学院,nan,China
岳阳学院,nan,China
衡阳师范学院南岳学院,nan,China
湖南工程学院应用技术学院,nan,China
湖南中医药大学湘杏学院,Xiangxin College  Hunan University of Traditional Chinese Medicine,China
张家界学院,nan,China
长沙理工大学城南学院,nan,China
长沙师范学院,Changsha Normal University,China
湖南应用技术学院,Hunan Applied Technology University,China
湖南信息学院,Hunan Institute of Information Technology,China
湖南交通工程学院,Hunan Institute of Traffic Engineering,China
湖南软件职业技术大学,nan,China
湖南汽车工程职业大学,nan,China
长沙科技学院,nan,China
湘中幼儿师范高等专科学校,nan,China
长沙民政职业技术学院,nan,China
湖南工业职业技术学院,nan,China
株洲师范高等专科学校,nan,China
湖南信息职业技术学院,nan,China
湖南税务高等专科学校,nan,China
湖南冶金职业技术学院,nan,China
长沙航空职业技术学院,nan,China
湖南大众传媒职业技术学院,nan,China
永州职业技术学院,nan,China
湖南铁道职业技术学院,nan,China
湖南科技职业学院,nan,China
湖南生物机电职业技术学院,nan,China
湖南交通职业技术学院,nan,China
湖南商务职业技术学院,nan,China
湖南体育职业学院,nan,China
湖南工程职业技术学院,nan,China
保险职业学院,nan,China
湖南外贸职业学院,nan,China
湖南网络工程职业学院,nan,China
邵阳职业技术学院,nan,China
湖南司法警官职业学院,nan,China
长沙商贸旅游职业技术学院,nan,China
湖南环境生物职业技术学院,nan,China
湖南邮电职业技术学院,nan,China
湘潭医卫职业技术学院,nan,China
郴州职业技术学院,nan,China
娄底职业技术学院,nan,China
张家界航空工业职业技术学院,nan,China
长沙环境保护职业技术学院,nan,China
湖南艺术职业学院,nan,China
湖南机电职业技术学院,nan,China
长沙职业技术学院,nan,China
怀化职业技术学院,nan,China
岳阳职业技术学院,nan,China
常德职业技术学院,nan,China
长沙南方职业学院,nan,China
潇湘职业学院,nan,China
湖南化工职业技术学院,nan,China
湖南城建职业技术学院,nan,China
湖南石油化工职业技术学院,nan,China
湖南中医药高等专科学校,nan,China
湖南民族职业学院,nan,China
湘西民族职业技术学院,nan,China
湖南财经工业职业技术学院,nan,China
益阳职业技术学院,nan,China
湖南工艺美术职业学院,nan,China
湖南九嶷职业技术学院,nan,China
湖南理工职业技术学院,nan,China
长沙电力职业技术学院,nan,China
湖南水利水电职业技术学院,nan,China
湖南现代物流职业技术学院,nan,China
湖南高速铁路职业技术学院,nan,China
湖南铁路科技职业技术学院,nan,China
湖南安全技术职业学院,nan,China
湖南电气职业技术学院,nan,China
湖南外国语职业学院,nan,China
益阳医学高等专科学校,nan,China
湖南都市职业学院,nan,China
湖南电子科技职业学院,nan,China
湖南国防工业职业技术学院,nan,China
湖南高尔夫旅游职业学院,nan,China
湖南工商职业学院,nan,China
湖南三一工业职业技术学院,nan,China
长沙卫生职业学院,nan,China
湖南食品药品职业学院,nan,China
湖南有色金属职业技术学院,nan,China
湖南吉利汽车职业技术学院,nan,China
湖南幼儿师范高等专科学校,nan,China
湘南幼儿师范高等专科学校,nan,China
湖南劳动人事职业学院,nan,China
怀化师范高等专科学校,nan,China
永州师范高等专科学校,nan,China
衡阳幼儿师范高等专科学校,nan,China
长沙幼儿师范高等专科学校,nan,China
益阳师范高等专科学校,nan,China
娄底幼儿师范高等专科学校,nan,China
常德科技职业技术学院,nan,China
邵阳工业职业技术学院,nan,China
长沙轨道交通职业学院,nan,China
长沙文创艺术职业学院,nan,China
岳阳现代服务职业学院,nan,China
郴州思科职业学院,nan,China
衡阳科技职业学院,nan,China
怀化工商职业技术学院,nan,China
湘潭科技职业学院,nan,China
长沙医药健康职业学院,nan,China
长沙科技职业学院,nan,China
株洲科技职业学院,nan,China
衡阳理工职业学院,nan,China
郴州智能科技职业学院,nan,China
岳阳科技职业学院,nan,China
邵阳通航职业技术学院,nan,China
中山大学,Sun Yat-sen University,China
暨南大学,Jinan University,China
汕头大学,Shantou University,China
华南理工大学,South China University of Technology,China
华南农业大学,South China Agricultural University,China
广东海洋大学,Guangdong Ocean University,China
广州医科大学,Guangzhou Medical University,China
广东医科大学,Guangdong Medical University,China
广州中医药大学,Guangzhou University of Chinese Medicine,China
广东药科大学,Guangdong Pharmaceutical University,China
华南师范大学,South China Normal University,China
韶关学院,Shaoguan University,China
惠州学院,Huizhou University,China
韩山师范学院,Hanshan Normal University,China
岭南师范学院,Lingnan Normal University,China
肇庆学院,Zhaoqing University,China
嘉应学院,Jiaying University,China
广州体育学院,Guangzhou Sport University,China
广州美术学院,Guangzhou Academy of Fine Arts,China
星海音乐学院,Xinghai Conservatory of Music,China
广东技术师范大学,Guangdong Polytechnic Normal University,China
深圳大学,Shenzhen University,China
广东财经大学,Guangdong University of Finance and Economics,China
广东白云学院,Guangdong Baiyun University,China
广州大学,Guangzhou University,China
广州航海学院,Guangzhou Maritime Institute,China
广东警官学院,Guangdong Police College,China
仲恺农业工程学院,Zhongkai University of Agriculture and Engineering,China
五邑大学,Wuyi University,China
广东金融学院,Guangdong University of Finance,China
电子科技大学中山学院,nan,China
广东石油化工学院,Guangdong University of Petrochemical Technology,China
东莞理工学院,Dongguan University of Technology,China
广东工业大学,Guangdong University of Technology,China
广东外语外贸大学,Guangdong University of Foreign Studies,China
佛山大学,nan,China
广东培正学院,nan,China
南方医科大学,Southern Medical University,China
广东东软学院,Neusoft Institute Guangdong,China
广州城市理工学院,nan,China
广州软件学院,nan,China
广州南方学院,nan,China
广东外语外贸大学南国商学院,nan,China
广州华商学院,nan,China
湛江科技学院,nan,China
华南农业大学珠江学院,Zhujiang College  South China Agricultural University,China
广州理工学院,nan,China
北京师范大学珠海分校,nan,China
广州华立学院,nan,China
广州应用科技学院,nan,China
广州商学院,Guangzhou College of Commerce,China
北京理工大学珠海学院,Beijing Institute of Technology  Zhuhai,China
珠海科技学院,Zhuhai College of Science and Technology,China
广州工商学院,Guangzhou College of Technology and Business,China
广州科技职业技术大学,nan,China
广东科技学院,Guangdong University of Science and Technology,China
广东理工学院,Guangdong Polytechnic College,China
广东工商职业技术大学,nan,China
东莞城市学院,nan,China
广州新华学院,nan,China
广东第二师范学院,nan,China
南方科技大学,Southern University of Science and Technology,China
深圳技术大学,Shenzhen Technology University,China
北京师范大学-香港浸会大学联合国际学院,BNU-HKBU United International College,China
香港科技大学（广州）,nan,China
香港中文大学（深圳）,The Chinese University of Hong Kong  Shenzhen,China
