chinese_name,english_name
A.P.J.阿卜杜尔卡拉姆博士科技大学,Dr. A.P.J. Abdul Kalam Technical University
安得拉邦国家理工学院,National Institute of Technology Andhra Pradesh
阿查里亚龙树大学,Acharya Nagarjuna University
阿姆里塔威施瓦威达匹萨姆学院,Amrita Vishwa Vidyapeetham
阿格拉森喜玛拉雅加瓦尔大学,Maharaja Agrasen Himalayan Garhwal University
阿姆拉瓦蒂大学,Amravati University
阿格拉毗姆劳安贝德卡尔博士大学,Dr.Bhimrao Ambedkar University  Agra
奥里萨邦农业与技术大学,Odisha University of Agriculture and Technology
阿希尔亚女神大学,Devi Ahilya Vishwavidyalaya
安那大学,Anna University
阿拉哈巴德大学,University of Allahabad
安得拉大学,Andhra University
阿拉嘎帕大学,Alagappa University
阿里格尔穆斯林大学,Aligarh Muslim University
安纳马莱大学,Annamalai University
奥斯马尼亚大学,Osmania University
阿尔尼大学,Arni University
阿米提大学,Amity University
贝内特大学,Bennett University
巴巴萨赫布安贝德卡尔默拉特瓦拉博士大学,Dr. Babasaheb Ambedkar Marathwada University
博帕尔印度科学教育与研究学院,Indian Institute of Science Education and Research Bhopal
巴拉特高等教育与研究学院,Bharath Institute of Higher Education & Research
辨喜瑜伽研究学院,Swami Vivekananda Yoga Anusandhana Samsthana
巴拉西达萨恩大学,Bharathidasan University
北阿坎德邦梵语大学,Uttarakhand Sanskrit University
北阿坎德邦技术大学,Uttarakhand Technical University
巴尔达曼大学,The University of Burdwan
伯尔格杜尔拉赫大学,Barkatullah University
比久伯德纳耶格科技大学,Biju Patnaik University of Technology
巴拉西耶尔大学,Bharathiar University
本地治理大学,Pondicherry University
巴拉理工学院,Birla Institute of Technology
北孟加拉邦大学,University of North Bengal
B.S阿卜杜勒拉赫曼新月科技学院,B. S. Abdur Rahman Crescent Institute Of Science & Technology
贝拿勒斯印度教大学,Banaras Hindu University
班加罗尔大学,Bangalore University
巴拉科技学院,The Birla Institute of Technology and Science
昌迪加尔大学,Chandigarh University
查罗塔尔科技大学,Charotar University of Science and Technology
C.V.拉曼博士大学,Dr. C.V.Raman University
杜尔加布尔国家技术学院,National Institute of Technology  Durgapur
蒂拉克马哈拉施特拉邦学院,Tilak Maharashtra Vidyapeeth
迪恩达亚尔乌巴特亚耶戈勒克布尔大学,Deen Dayal Upadhyay Gorakhpur University
达亚南达萨格尔大学,Dayananda Sagar University
东北山区大学,North-Eastern Hill University
达阿尔巴格教育学院,Dayalbagh Educational Institute
蒂鲁吉拉伯利国家技术学院,National Institute of Technology Tiruchirapalli
德里大学,University of Delhi
达尔瓦德卡纳塔克大学,"Karnatak University, Dharwad"
德里技术大学,Delhi Technological University
EIILM大学,EIILM University
甘地技术管理大学,Gandhi Institute of Technology and Management  University
国立药物教育研究学院,National Institute of Pharmaceutical Education and Research
国家时装技术学院,National Institute of Fashion Technology
甘地格拉姆乡村学院,The Gandhigram Rural Institute
戈芬德巴拉布彭特农业技术大学,G.B.Pant University of Agriculture & Technology
高尔本格大学,University of Gour Banga
格恩努尔大学,Kannur University
国家圣徒图克多基马哈拉伊那格浦尔大学,Rashtrasant Tukadoji Maharaj Nagpur University
高哈提大学,Gauhati University
国家伊斯兰大学,Jamia Millia Islamia
古吉拉特大学,Gujarat University
古鲁格谢德拉大学,Kurukshetra University
古鲁杰默贝什沃尔科技大学,Guru Jambeshwar University of Science and Technology
管理学综合学院,Institute for Integrated Learning in Management
古鲁戈宾德辛格因德勒布勒斯特大学,Guru Gobind Singh Indraprastha University
果阿大学,Goa University
古吉拉特技术大学,Gujarat Technological University
国王瑟亚吉拉奥巴罗达大学,Maharaja Sayajirao University of Baroda
革命家什亚姆吉克里希纳沃尔马格杰奇大学,Krantiguru Shyamji Krishna Verma Kachchh University
花园城市大学,Garden City University
海得拉巴尼赫鲁科技大学,Jawaharlal Nehru Technological University Hyderabad
霍米巴巴国家学院,Homi Bhabha National Institute
海洋工程研究学院,Marine Engineering and Research Institute
哈米尔普尔国家技术学院,National Institute of Technology  Hamirpur
化学技术学院,Institute of Chemical Technology
海得拉巴大学,University of Hyderabad
哈里辛格高尔博士大学,Dr. Harisingh Gour Vishwavidyalaya
ICFAI大学,The ICFAI University
贾朗达尔比姆拉奥·拉姆吉·安贝德卡尔国家技术学院,Dr. B. R. Ambedkar national Institute of Technology  Jalandhar
教育高级研究院,Institute of Advanced Studies in Education Deemed University
加济阿巴德管理技术学院,Institute of Management Technology  Ghaziabad
基督学院,CHRIST University
贾伊恩学院,JAIN (Deemed-to-be University)
贾姆谢德布尔国家技术学院,National Institute of Technology Jamshedpur
贾米亚哈姆达德学院,Jamia Hamdard
加尔各答印度科学教育与研究学院,Indian Institute of Science Education and Research Kolkata
贾德沃布尔大学,Jadavpur University
吉瓦吉大学,Jiwaji University
贾达普大学,Jadavpur University
加瓦尔黑姆瓦迪嫩登综合性大学,Hemwati Nandan Bahuguna Garhwal University
杰伊纳拉扬维亚斯大学,Jai Narain Vyas University
加尔各答大学,University of Calcutta
羯陵伽大学,Kalinga University
贾迪什普拉萨德切伯尔默尔迪伯雷瓦拉先生大学,Shri Jagdish Prasad Jhabarmal Tibrewala University
贾伊比信息技术大学,Jaypee University of Information Technology
羯陵伽工业技术学院,Kalinga Institute of Industrial Technology
卡纳塔克中央大学,Central University of Karnataka
卡利亚尼大学,University of Kalyani
卡基纳达尼赫鲁科技大学,Jawaharlal Nehru Technological University Kakinada
卡纳塔克邦塞阿斯卡尔国家技术学院,National Institute of Technology Karnataka  Surathkal
卡利卡特大学,University of Calicut
卡拉萨林根研究与教育学院,Kalasalingam Academy of Research and Education
卡利卡特国家技术学院,National Institute of Technology Calicut
库鲁克谢特拉国家技术学院,National Institute of Technology  Kurukshetra
科内鲁·拉克什迈亚教育基金会学院,Koneru Lakshmaiah Education Foundation
喀拉拉大学,University of Kerala
库马温大学,Kumaun University
喀拉拉邦农业大学,Kerala Agricultural University
卡卡提亚大学,Kakatiya University
坎普尔查特拉帕蒂沙胡吉马哈拉杰大学,Chhatrapati Shahu Ji Maharaj University  Kanpur
科学与创新研究学院,Academy of Scientific and Innovative Research
科钦科技大学,Cochin University of Science and Technology
卡伦扬技术与科学学院,Karunya Institute of Technology and Sciences
克里希纳库玛尔辛格帕沃纳格尔国王大学,Maharaja Krishnakumarsinhji Bhavnagar University
鲁尔克拉国家技术学院,National Institute of Technology Rourkela
拉贾斯坦邦贾纳丹·赖·纳加尔维迪亚佩斯学院,Janardan Rai Nagar Rajasthan Vidyapeeth University
罗摩克里希那传道会维韦卡南达教育与研究学院,Ramakrishna Mission Vivekananda Educational and Research Institute
拉吉夫甘地健康科学大学,Rajiv Gandhi University of Health Sciences
拉吉夫甘地科技大学,Rajiv Gandhi Prodoyogiki Vishwavidyalaya
拉贾斯坦大学,University of Rajasthan
勒克瑙大学,University of Lucknow
拉姆马诺洛西亚阿瓦德博士土邦大学,Dr. Ram Manohar Lohia Awadh University
罗宾德拉纳特泰戈尔大学（前身为AISECT大学）,Rabindranath Tagore University (formerly known as AISECT University)
拉雅拉西马大学,Rayalaseema University
拉夫里专业大学,Lovely Professional University
罗塔克马哈希达亚南德大学,Maharshi Dayanand University  Rohtak
马尼帕尔大学,Manipal University
马格特大学,Magadh University
梅加拉亚国家技术学院,National Institute of Technology Meghalaya
马拉维亚国家理工学院,Malaviya National Institute of Technology
毛拉纳阿扎德理工学院,Maulana Azad National Institute of Technology
门格洛尔大学,Mangalore University
玛克恩拉尔杰杜尔韦蒂国立新闻与传播大学,Makhanlal Chaturvedi National University of Journalism & Communication
孟买大学,University of Mumbai
马杜赖卡马拉杰大学,Madurai Kamaraj University
默诺默尼耶姆孙德尔纳尔大学,Manonmaniam Sundaranar University
M.J.P.罗希尔汉德大学,M.J.P. Rohilkhand University
毛拉那阿扎德国家乌尔都大学,Maulana Azad National Urdu University
米佐拉姆大学,Mizoram University
密拉特乔杜里·查兰·辛格大学,Chaudhary Charan Singh University  Meerut
米佐拉姆国家技术学院,National Institute of Technology Mizoram
马德拉斯大学,University of Madras
迈索尔大学,University of Mysore
梅沃尔大学,Mewar University
马尼帕尔高等教育学院,Manipal Academy of Higher Education
马哈尔希达亚南德萨拉斯瓦蒂大学,Maharshi Dayanand Saraswati University  Ajmer
那格浦尔维斯瓦拉亚国家技术学院,Visvesvaraya National Institute of Technology  Nagpur
那加兰邦国家技术学院,National Institute of Technology Nagaland
纳兰达学院,Nalanda College  Biharsharif
女王杜尔加瓦蒂大学,Rani Durgavati Vishwavidyalaya
尼赫鲁科技大学,Jawaharlal Nehru Technological University
尼赫鲁高级科学研究中心,Jawaharlal Nehru Centre For Advanced Scientific Research
尼赫鲁大学,Jawaharlal Nehru University
尼尔玛大学,Nirma University
尼赫鲁科技大学阿嫩达布尔,Jawaharlal Nehru Technological University Anantapur
那格浦尔大学,Nagpur University
O.P.金达尔全球学院,O.P. Jindal Global University
帕蒂亚拉塔帕尔工程技术学院,Thapar Institute of Engineering and Technology  Patiala
普纳帕拉蒂维迪雅皮斯学院,Bharati Vidyapeeth
普纳高级技术国防学院,Defence Institute of Advanced Technology  Pune
旁遮普农业大学,Punjab Agricultural University
旁遮普技术大学,Punjab Technical University
Pt拉维申格尔舒格拉大学,Pt. Ravishankar Shukla University
旁遮普大学,Panjab University
旁遮普中央大学,Central University of Punjab
佩里亚大学,Periyar University
乔特里瑟尔文库玛尔喜马偕尔邦农业大学,Chaudhary Sarwan Kumar Himachal Pradesh Krishi Vishvavidyalaya
圣雄甘地大学,Mahatama Gandhi University
苏拉特萨达尔瓦拉布哈伊国家技术学院,Sardar Vallabhbhai National Institute of Technology  Surat
萨巴马蒂大学,Sabarmati University
山姆希金波顿农业、技术与科学研究所,Sam Higginbottom Institute of Agriculture  Technology & Sciences
苏里尼大学,Shoolini University
萨雅巴玛学院,Sathyabama University
斯里·奇特拉·蒂鲁纳尔医学科学与技术学院,Sree Chitra Tirunal Institute for Medical Sciences and
苏曼迪普·维迪亚佩斯学院,Sumandeep Vidyapeeth
萨维德里普莱浦那大学,Savitribai Phule Pune University
斯瓦米拉玛嫩德朝圣默拉特瓦拉大学,Swami Ramanand Teerth Marathwada University
圣人古鲁那纳克大学,Guru Nanak Dev University
圣雄甘地农业大学,Mahatma Gandhi Kashi Vidyapeeth
室利克里什纳大学,Sri krishnadevaraya University
斯派塞纪念学院,Spicer Memorial College
圣隆格奥瓦尔工程技术学院,Sant Longowal Institute of Engineering and Technology
室利文格黛斯瓦拉大学,Sri Venkateswara University
SRM大学,SRM University
石油与能源研究大学,University of Petroleum and Energy Studies
沙尔达大学,Sharda University
绍皮德大学,Shobhit University
索拉什特拉大学,Saurashtra University
萨达尔帕特尔大学,Sardar Patel University
泰米尔纳德邦农业大学,Tamil Nadu Agricultural University
特里凡得琅印度科学教育与研究学院,Indian Institute of Science Education and Research  Thiruvananthapuram
塔塔基础研究院,Tata Institute of Fundamental Research
提鲁瓦鲁瓦大学,Thiruvalluvar University
泰米尔纳德邦博士M.G.拉马钱德兰医科大学,The Tamilnadu Dr. M.G.R. Medical University
塔塔社科学院,Tata Institute of Social Sciences
太平洋高等教育研究院大学,Pacific Academy of Higher Education Research University
韦洛尔理工学院,Vellore Institute of Technology
维什沃格尔玛大学,Vishwakarma University
维德雅瑟格大学,Vidyasagar University
瓦兰加尔国家技术学院,National Institute of Technology Warangal
伟大的诗人迦梨陀娑梵语大学,Kavi Kulguru Kalidas Sanskrit Vishwavidyalaya
韦斯科技大学,Visvesvaraya Technological University
维纳耶格使命锡金邦大学,Vinayaka Missions Sikkim University
维尔纳尔默德南古吉拉特大学,Veer Narmad South Gujarat University
西尔恰尔阿萨姆大学,Assam University  Silchar
西孟加拉邦毛拉·阿布·卡拉姆·阿扎德技术大学,Maulana Abul Kalam Azad University of Technology  West Bengal
锡尔杰尔国家技术学院,National Institute of Technology Silchar
希瓦吉大学,Shivaji University
喜马偕尔邦大学,Himachal Pradesh University
西尼亚大学,Singhania University
希普尔印度工程科学与技术学院,Indian Institute of Engineering Science and Technology  Shibpur
锡金邦玛尼帕尔大学,Sikkim Manipal University
印度理工学院果阿分校,Indian Institute of Technology Goa
印度科学培育协会学院,Indian Association for the Cultivation of Science
印度理工学院巴特那分校,Indian Institute of Technology Patna
印度理工学院卡拉格普尔分校,Indian Institute of Technology Kharagpur
印度统计学院,Indian Statistical Institute
印多尔印度管理学院,Indian Institute of Management Indore
印度理工学院焦特布尔分校,Indian Institute of Technology Jodhpur
印度教育与研究科学学院莫哈利分校,Indian Institute of Science Education and Research Mohali
印度理工学院瓦拉纳西分校（巴纳拉斯印度大学）,Indian Institute of Technology (Banaras Hindu University)  Varanasi
印度理工学院布巴内斯瓦尔分校,Indian Institute of Technology Bhubaneswar
印度斯坦科技学院,Hindustan Institute of Technology and Science
印度理工学院丹巴德分校（印度矿业学院）,Indian Institute of Technology (Indian School of Mines)  Dhanbad
印度理工学院印多尔分校,Indian Institute of Technology Indore
印度理工学院孟买分校,Indian Institute of Technology Bombay
印度国际大学,Visva Bharati
印度理工学院曼迪分校,Indian Institute of Technology Mandi
约吉维马拉大学,Yogi Vemana University
印度理工学院海德巴拉分校,Indian Institute of Technology Hyderabad
印度理工学院甘地讷格尔分校,Indian Institute of Technology Gandhinagar
艺术科技研究学院（萨斯特拉）,Shanmugha Arts  Science  Technology & Research Academy (SASTRA)
印度理工学院德里分校,Indian Institute of Technology Delhi
印度理工学院罗巴尔分校,Indian Institute of Technology Ropar
印度理工学院比莱分校,Indian Institute of Technology Bhilai
印度理工学院坎普尔分校,Indian Institute of Technology Kanpur
印度科学学院,Indian Institute of Science
印度理工学院古瓦哈提分校,Indian Institute of Technology Guwahati
印度理工学院马德拉斯分校,Indian Institute of Technology Madras
英语与外国语大学,The English And Foreign Languages University
印度理工学院鲁基分校,Indian Institute of Technology Roorkee
斋浦尔IIS学院,IIS (Deemed to be University)  Jaipur
斋浦尔国家大学,Jaipur National University
